{
  "$schema": "./schema/open-platform-capability-matrix.schema.json",
  "schemaVersion": "v0.0.1:registry:open-platform-capability-matrix-1",
  "description": "Machine-readable evidence matrix for open platform release capability audits. Paths are repository-relative and contain no runtime-local data.",
  "statusEnum": [
    "implemented",
    "partial",
    "missing",
    "disconnected",
    "non_current",
    "non_runnable"
  ],
  "capabilities": [
    {
      "id": "upstream-gateway",
      "capabilityClass": "core",
      "title": "Governed Upstream Service Gateway",
      "docs": [
        "README.md",
        "docs/functionality/GATEWAY.md",
        "docs/protocols/PROTOCOLS.md"
      ],
      "requirementRows": [
        "Gateway Requirements",
        "Governed Upstream Service Gateway"
      ],
      "requiredRuntimePrefixes": [
        "gateway.",
        "external_services."
      ],
      "knownProtocolPrefixes": [
        "gateway.",
        "external_services."
      ],
      "mcpOutlets": [
        "meshrix.gateway"
      ],
      "expectedConsoleFeatures": [
        "admin.upstream-services",
        "admin.gateway-routes"
      ],
      "verifierScripts": [
        "tools/server-scripts/verify-external-gateway.ts",
        "tools/server-scripts/verify-upstream-gateway-e2e.ts",
        "tools/server-scripts/verify-upstream-mcp-gateway-e2e.ts",
        "tools/server-scripts/verify-upstream-fixture-transit.ts"
      ],
      "requiredEdges": [
        "serverOperations",
        "toolCatalog",
        "mcpOutlet",
        "httpRoutes",
        "console",
        "verifier"
      ]
    },
    {
      "id": "downstream-mcp",
      "capabilityClass": "core",
      "title": "Downstream MCP Gateway Completeness",
      "docs": [
        "README.md",
        "docs/protocols/PROTOCOLS.md",
        "packages/protocols/mcp/adapter/native-installer/README.md"
      ],
      "requirementRows": [
        "MCP Requirements",
        "Downstream MCP Gateway Completeness"
      ],
      "requiredRuntimePrefixes": [
        "operation_permission."
      ],
      "mcpOutlets": [
        "meshrix.discovery",
        "meshrix.gateway"
      ],
      "allowedMcpTargets": "$MCP_SUPPORTED_TARGETS",
      "expectedConsoleFeatures": [
        "admin.operation-permission-governance"
      ],
      "verifierScripts": [
        "tools/verifiers/downstream-mcp-completeness-audit.ts",
        "tools/server-scripts/mcp-doctor.ts",
        "tools/server-scripts/verify-mcp-installer-convergence.ts",
        "tools/server-scripts/verify-mcp-release-target-scope.ts",
        "tools/server-scripts/verify-mcp-release-portable-assembly.ts",
        "tools/server-scripts/verify-downstream-agent-tool-loop.ts",
        "tools/server-scripts/verify-mcp-proxy-transport.ts"
      ],
      "requiredEdges": [
        "serverOperations",
        "toolCatalog",
        "mcpOutlet",
        "httpRoutes",
        "console",
        "verifier"
      ]
    },
    {
      "id": "strategy-management",
      "capabilityClass": "detachable-core",
      "activationFeatureId": "strategy-management",
      "title": "Strategy Management Policy Preview",
      "docs": [
        "docs/functionality/STRATEGY-MANAGEMENT.md",
        "docs/protocols/PROTOCOLS.md"
      ],
      "requirementRows": [
        "Strategy Management Requirements",
        "Strategy Management Policy Preview"
      ],
      "requiredRuntimePrefixes": [
        "strategy."
      ],
      "mcpOutlets": [
        "meshrix.gateway"
      ],
      "expectedConsoleFeatures": [
        "admin.strategy-management"
      ],
      "verifierScripts": [
        "tools/server-scripts/verify-strategy-management.ts"
      ],
      "requiredEdges": [
        "serverOperations",
        "toolCatalog",
        "mcpOutlet",
        "httpRoutes",
        "console",
        "verifier"
      ]
    },
    {
      "id": "enterprise-governance",
      "capabilityClass": "core",
      "title": "Enterprise Governance And Observability",
      "docs": [
        "docs/functionality/SECURITY-AUTHORIZATION.md",
        "docs/functionality/OPERATIONS-OBSERVABILITY.md"
      ],
      "requirementRows": [
        "Operation Permission Requirements",
        "Tag Policy Requirements",
        "Observability Requirements",
        "Enterprise Governance Observability"
      ],
      "requiredRuntimePrefixes": [
        "authorization.",
        "tag_management.",
        "security_alerts.",
        "production.",
        "operation_permission.metrics_"
      ],
      "knownProtocolPrefixes": [
        "tag_management."
      ],
      "mcpOutlets": [
        "meshrix.gateway"
      ],
      "expectedConsoleFeatures": [
        "admin.tag-management",
        "admin.production-health",
        "admin.ops-monitor"
      ],
      "verifierScripts": [
        "tools/server-scripts/verify-tag-management.ts",
        "tools/server-scripts/verify-security-alert-lifecycle.ts",
        "tools/server-scripts/verify-production-health-console.ts",
        "tools/server-scripts/verify-observability-semantics.ts"
      ],
      "requiredEdges": [
        "serverOperations",
        "toolCatalog",
        "mcpOutlet",
        "httpRoutes",
        "console",
        "verifier"
      ]
    },
    {
      "id": "console-administration",
      "capabilityClass": "core",
      "title": "Console Administration Workflows",
      "docs": [
        "apps/console/router/admin-route-registry.ts",
        "packages/foundation/config/frontend-feature-registry.yaml"
      ],
      "requirementRows": [
        "Console Administration Workflows"
      ],
      "requiredRuntimePrefixes": [
        "operation_permission.",
        "tag_management.",
        "gateway."
      ],
      "expectedConsoleFeatures": [
        "admin.operation-permission-governance",
        "admin.tag-management",
        "admin.upstream-services",
        "admin.gateway-routes",
        "admin.storage-control",
        "admin.jobs-control"
      ],
      "verifierScripts": [
        "tools/server-scripts/verify-production-health-console.ts",
        "tests/verify-frontend-route-registry.ts"
      ],
      "requiredEdges": [
        "serverOperations",
        "console",
        "verifier"
      ]
    },
    {
      "id": "container-deployment",
      "capabilityClass": "core",
      "title": "Container Deployment Resumability",
      "docs": [
        "Dockerfile",
        "docker-compose.yml",
        "docs/RUNBOOK.md"
      ],
      "requirementRows": [
        "Container Deployment Resumability"
      ],
      "requiredFiles": [
        "Dockerfile",
        "docker-compose.yml",
        "package-lock.json",
        "tools/server-scripts/prepare-npm-artifact-cache.ts"
      ],
      "verifierScripts": [
        "tools/server-scripts/prepare-npm-artifact-cache.ts",
        "tools/server-scripts/verify-deployment-container-flow.ts"
      ],
      "requiredEdges": [
        "sourceFiles",
        "verifier"
      ]
    },
    {
      "id": "storage",
      "capabilityClass": "core",
      "title": "Storage And Backup Runtime",
      "docs": [
        "packages/foundation/src/storage/README.md",
        "docs/RUNBOOK.md"
      ],
      "requirementRows": [
        "Core Platform Release Convergence"
      ],
      "requiredRuntimePrefixes": [
        "storage."
      ],
      "mcpOutlets": [
        "meshrix.gateway"
      ],
      "expectedConsoleFeatures": [
        "admin.storage-control"
      ],
      "verifierScripts": [
        "tools/server-scripts/verify-backup-restore.ts",
        "tools/server-scripts/verify-storage-production-restore-drill.ts"
      ],
      "requiredEdges": [
        "serverOperations",
        "toolCatalog",
        "httpRoutes",
        "console",
        "verifier"
      ]
    },
    {
      "id": "jobs",
      "capabilityClass": "core",
      "title": "Jobs And Work Queue Runtime",
      "docs": [
        "docs/functionality/INGESTION-JOBS.md",
        "packages/foundation/src/work-queue/README.md"
      ],
      "requirementRows": [
        "Core Platform Release Convergence"
      ],
      "requiredRuntimePrefixes": [
        "jobs."
      ],
      "mcpOutlets": [
        "meshrix.gateway"
      ],
      "expectedConsoleFeatures": [
        "admin.jobs-control"
      ],
      "verifierScripts": [
        "tools/server-scripts/verify-job-work-queue.ts",
        "tools/server-scripts/verify-job-work-queue-capacity.ts",
        "tools/server-scripts/verify-work-queue-conformance.ts",
        "tools/server-scripts/verify-work-queue-process-restart.ts",
        "tools/server-scripts/verify-upload-workspace-materialization.ts"
      ],
      "requiredEdges": [
        "serverOperations",
        "toolCatalog",
        "httpRoutes",
        "console",
        "verifier"
      ]
    },
    {
      "id": "external-plugin-packaging-loading",
      "capabilityClass": "external-plugin",
      "title": "External Plugin Packaging And Loading",
      "docs": [
        "docs/protocols/PLUGIN-PACKAGE-AND-LOADING.md",
        "docs/functionality/SERVER-RUNTIME.md"
      ],
      "requirementRows": [
        "External Plugin Packaging And Loading"
      ],
      "requiredFiles": [
        "packages/foundation/src/module-system/plugin-runtime.ts",
        "packages/foundation/src/module-system/plugin-registry.ts",
        "packages/foundation/src/module-system/mount-manager.ts"
      ],
      "verifierScripts": [
        "tools/server-scripts/verify-plugin-runtime.ts"
      ],
      "requiredEdges": [
        "sourceFiles",
        "verifier"
      ]
    },
    {
      "id": "agent-gateway-model-routing",
      "capabilityClass": "detachable-core",
      "activationFeatureId": "agent-gateway",
      "title": "Agent Gateway And Model Routing",
      "docs": [
        "docs/functionality/AGENT-GATEWAY.md",
        "docs/protocols/PROTOCOLS.md"
      ],
      "requirementRows": [
        "Agent Gateway And Model Routing"
      ],